{
  "$schema": "../schema.json",
  "id": "HK",
  "type": "country",
  "flag": "🇭🇰",
  "region": "asia",
  "names": {"ja": "香港", "en": "Hong Kong"},
  "office": {"ja": "香港知識産権署・特許登録処（IPD）", "en": "Patents Registry, Intellectual Property Department (IPD)"},
  "aliases": {
    "ja": ["香港特別行政区", "香港", "HKIPD", "香港知識産権署"],
    "en": ["Hong Kong Special Administrative Region", "Hong Kong SAR", "Hong Kong", "HKSAR", "HKIPD", "IPD"]
  },
  "availableLanguages": ["ja", "en"],
  "optionLanguage": null,
  "createdAt": "2026-09-17",
  "updatedAt": "2026-09-17",
  "lastVerifiedAt": "2026-09-17",
  "status": "review",
  "summary": {
    "ja": "香港の特許制度は中国本土から独立しており、中国特許は香港へ自動的に及ばない。保護ルートには、香港へ直接出願し実体審査を受ける標準特許（O）、CNIPA・EPO（英国指定）・UKIPOの指定特許出願を二段階で再登録する標準特許（R）、および最長8年の短期特許がある。PCTの香港への直接国内移行はなく、指定特許庁、とりわけ中国国内段階を経由する期限管理が重要である。",
    "en": "Hong Kong has a patent system separate from mainland China, and a Chinese patent does not automatically extend to Hong Kong. Protection is available through a standard patent (O), filed directly in Hong Kong and substantively examined; a standard patent (R), obtained through a two-stage re-registration procedure based on a designated application before CNIPA, the EPO designating the United Kingdom, or the UKIPO; and a short-term patent with a maximum eight-year term. There is no direct PCT national phase in Hong Kong, making route and deadline management through a designated patent office, particularly the Chinese national phase, essential."
  },
  "searchTerms": {
    "ja": ["香港特許", "標準特許O", "原授標準特許", "標準特許R", "再登録標準特許", "短期特許", "指定特許庁", "二段階登録", "実体審査", "短期特許実体審査"],
    "en": ["Hong Kong patent", "standard patent O", "original grant patent", "standard patent R", "re-registration", "short-term patent", "designated patent office", "two-stage registration", "substantive examination"]
  },
  "quickView": [
    {
      "key": "protected_rights",
      "label": {"ja": "主要な保護ルート", "en": "Main protection routes"},
      "value": {"ja": "標準特許（O）、標準特許（R）、短期特許", "en": "Standard patent (O), standard patent (R), and short-term patent"},
      "sourceRefs": ["ipd_basics", "ipd_new_system"]
    },
    {
      "key": "national_phase_deadline",
      "label": {"ja": "PCT国内移行", "en": "PCT national phase"},
      "value": {"ja": "香港への直接国内移行はない。中国等の指定特許出願を基礎に香港手続を行う", "en": "No direct Hong Kong national phase; Hong Kong protection is pursued through a designated application such as the Chinese national phase"},
      "sourceRefs": ["ipd_basics", "ipd_standard_r"]
    },
    {
      "key": "examination_request_deadline",
      "label": {"ja": "標準特許（O）の審査請求", "en": "Standard patent (O) examination request"},
      "value": {"ja": "原則として出願日または最先優先日から3年以内", "en": "Generally within three years from the filing date or earliest priority date"},
      "sourceRefs": ["ipd_standard_o", "examination_guidelines"]
    },
    {
      "key": "custom_re_registration_deadlines",
      "label": {"ja": "標準特許（R）の期限", "en": "Standard patent (R) deadlines"},
      "value": {"ja": "第1段階は指定出願公開から6か月、第2段階は指定特許付与から6か月が原則", "en": "Stage 1 is generally due within six months from publication of the designated application and Stage 2 within six months from grant of the designated patent"},
      "sourceRefs": ["ipd_standard_r"]
    },
    {
      "key": "filing_language",
      "label": {"ja": "出願言語", "en": "Filing language"},
      "value": {"ja": "英語または中国語", "en": "English or Chinese"},
      "sourceRefs": ["patents_ordinance", "patents_rules"]
    },
    {
      "key": "grace_period",
      "label": {"ja": "新規性喪失の例外", "en": "Novelty grace period"},
      "value": {"ja": "明白な濫用または所定の国際博覧会による開示について限定的に6か月", "en": "A limited six-month exception for disclosure caused by evident abuse or at a prescribed international exhibition"},
      "sourceRefs": ["patents_ordinance", "examination_guidelines"]
    },
    {
      "key": "patent_term",
      "label": {"ja": "存続期間", "en": "Patent terms"},
      "value": {"ja": "標準特許は最長20年、短期特許は最長8年", "en": "Up to 20 years for a standard patent and eight years for a short-term patent"},
      "sourceRefs": ["ipd_general_faq", "ipd_standard_o", "ipd_standard_r"]
    },
    {
      "key": "custom_separate_system",
      "label": {"ja": "中国本土との関係", "en": "Relationship with mainland China"},
      "value": {"ja": "中国本土の特許は香港で自動的に効力を有しない", "en": "A mainland Chinese patent has no automatic effect in Hong Kong"},
      "sourceRefs": ["ipd_basics"]
    }
  ],
  "sections": [
    {
      "id": "system_overview",
      "title": {"ja": "制度の基本情報", "en": "System overview"},
      "facts": [
        {"key": "authority", "label": {"ja": "所管官庁", "en": "Authority"}, "value": {"ja": "香港特別行政区政府・知識産権署（IPD）の特許登録処。", "en": "The Patents Registry of the Intellectual Property Department (IPD), Government of the Hong Kong SAR."}, "sourceRefs": ["ipd_basics"]},
        {"key": "governing_law", "label": {"ja": "主な根拠法令", "en": "Principal legislation"}, "value": {"ja": ["特許条例（香港法例第514章）", "特許（一般）規則（香港法例第514C章）", "特許審査指南"], "en": ["Patents Ordinance (Cap. 514)", "Patents (General) Rules (Cap. 514C)", "Patents Examination Guidelines"]}, "sourceRefs": ["patents_ordinance", "patents_rules", "examination_guidelines"]},
        {"key": "protected_rights", "label": {"ja": "特許の種類", "en": "Types of patent"}, "value": {"ja": ["標準特許（O）：香港独自の原授特許", "標準特許（R）：指定特許庁の出願・特許を基礎とする再登録", "短期特許：調査報告を伴う最長8年の権利"], "en": ["Standard patent (O): an original grant by Hong Kong", "Standard patent (R): re-registration based on an application and patent at a designated patent office", "Short-term patent: an eight-year right supported by a search report"]}, "sourceRefs": ["ipd_basics", "ipd_new_system"]},
        {"key": "utility_model", "label": {"ja": "実用新案に相当する制度", "en": "Utility-model equivalent"}, "value": {"ja": "名称上の実用新案制度はないが、短期特許が迅速・短期間の保護手段として近い機能を担う。対象は製品構造に限定されず、発明一般を対象とし得る。", "en": "There is no right called a utility model, but the short-term patent serves a comparable rapid, shorter-term function. It is not limited to product shape or structure and may cover inventions generally."}, "sourceRefs": ["ipd_basics", "ipd_short_term"]},
        {"key": "paris_convention", "label": {"ja": "優先権", "en": "Priority"}, "value": {"ja": "標準特許（O）および短期特許では、パリ条約国またはWTO加盟地域等の第一国出願から通常12か月以内に優先権を主張できる。", "en": "For a standard patent (O) or short-term patent, priority may generally be claimed within 12 months from a first filing in a Paris Convention or WTO jurisdiction, subject to the statutory conditions."}, "sourceRefs": ["patents_ordinance", "ipd_apply"]},
        {"key": "pct_membership", "label": {"ja": "PCTとの関係", "en": "PCT relationship"}, "value": {"ja": "香港は独立したPCT締約国・国内段階官庁ではない。中国を指定したPCT出願について、中国国内段階を指定出願として標準特許（R）または短期特許へつなぐルートがある。", "en": "Hong Kong is not a separate PCT contracting state or national-phase office. A PCT application designating China may proceed through the Chinese national phase and then support a standard patent (R) or, where applicable, a short-term patent route."}, "sourceRefs": ["ipd_standard_r", "ipd_short_term", "wipo_hk_profile"]},
        {"key": "regional_systems", "label": {"ja": "中国本土・マカオとの独立性", "en": "Separation from mainland China and Macao"}, "value": {"ja": "香港の特許は香港でのみ効力を有する。中国本土またはマカオでの保護には、それぞれ別個の手続が必要。", "en": "A Hong Kong patent is effective only in Hong Kong. Separate protection must be obtained for mainland China and Macao."}, "sourceRefs": ["ipd_basics"]},
        {"key": "publication_timing", "label": {"ja": "標準特許（O）の公開", "en": "Publication of standard patent (O) applications"}, "value": {"ja": "原則として出願日または最先優先日から18か月経過後、可能な限り速やかに公開される。早期公開請求も検討できる。", "en": "Publication generally occurs as soon as practicable after 18 months from the filing date or earliest priority date. Early publication may be requested."}, "sourceRefs": ["patents_ordinance", "examination_guidelines"]},
        {"key": "patent_term", "label": {"ja": "保護期間", "en": "Protection terms"}, "value": {"ja": "標準特許（O）は香港出願日から、標準特許（R）は指定特許出願日から最長20年。短期特許は香港出願日から最長8年。いずれも所定の更新が必要。", "en": "A standard patent (O) lasts up to 20 years from its Hong Kong filing date; a standard patent (R), up to 20 years from the designated application filing date; and a short-term patent, up to eight years from its Hong Kong filing date, subject to renewal."}, "sourceRefs": ["ipd_standard_o", "ipd_standard_r", "ipd_general_faq"]}
      ]
    },
    {
      "id": "pre_filing",
      "title": {"ja": "出願前の重要事項", "en": "Pre-filing considerations"},
      "facts": [
        {"key": "first_to_file", "label": {"ja": "先願基準", "en": "First-to-file principle"}, "value": {"ja": "同一発明については、有効な最先の出願日・優先日を有する出願が基本となる。発明者から権利を承継していることも必要。", "en": "For the same invention, the application with the earliest valid filing or priority date is generally controlling, subject to proper entitlement from the inventor."}, "sourceRefs": ["patents_ordinance", "examination_guidelines"]},
        {"key": "inventor_applicant_eligibility", "label": {"ja": "発明者・出願人", "en": "Inventor and applicant"}, "value": {"ja": "発明者、発明者の承継人、または法律・契約により権利を取得した者が出願資格を有し得る。発明者表示と権利承継書類を整合させる。", "en": "The inventor, successor in title, or another person deriving entitlement by law or agreement may apply. Inventorship and entitlement documentation should be kept consistent."}, "sourceRefs": ["patents_ordinance", "patents_rules"]},
        {"key": "employee_inventions", "label": {"ja": "従業者発明", "en": "Employee inventions"}, "value": {"ja": "通常の職務遂行中、または従業者の職務から生じる特別な義務の遂行中に完成した発明は、一定の場合に使用者へ帰属する。雇用契約と準拠法を確認する。", "en": "An invention made in the course of normal duties, or duties specifically assigned and giving rise to a special obligation, may belong to the employer. The employment agreement and governing law should be reviewed."}, "sourceRefs": ["patents_ordinance"]},